{"base_state_version":2,"gaps":[{"current_evidence_fact_ids":["synthetic-fact-001"],"gap_id":"GAP-001","reason":"The user has authored one deterministic Python unit test (synthetic-fact-001), which demonstrates testing capability but does not constitute a complete, reproducible, evidence-bound Agent workflow. The requirement calls for an end-to-end workflow with evidence binding, which is not evidenced by the single unit test alone.","requirement":"Build one reproducible, evidence-bound Agent workflow.","status":"gap"}],"program_id":"42fec130-9e27-4a01-9e0b-ac7d6b9b5403","proposal_type":"gap_assessment","unable_to_determine":[]}
