{"base_state_version":2,"gaps":[{"current_evidence_fact_ids":[],"gap_id":"gap-001","reason":"The only confirmed user fact (synthetic-fact-001) states the candidate has authored one deterministic Python unit test. This does not demonstrate building a reproducible, evidence-bound Agent workflow, which is a distinct and broader requirement involving workflow design, reproducibility guarantees, and evidence binding.","requirement":"Build one reproducible, evidence-bound Agent workflow.","status":"gap"}],"program_id":"42fec130-9e27-4a01-9e0b-ac7d6b9b5403","proposal_type":"gap_assessment","unable_to_determine":[]}
